<?xml version="1.0" encoding="UTF-8" standalone="yes"?>
<Ticket xmlns="http://example.org/ticket" xmlns:xsi="http://www.w3.org/2001/XMLSchema-instance" id="3" xsi:schemaLocation="http://example.org/ticket ../../schema/TicketSchema.xsd">
    <Infos>
        <Betreff>fdsfdsfdsaf</Betreff>
        <User id="1">Max Mustermann</User>
        <Standort>Max</Standort>
        <SupporterList>
            <Supporter id="1">Max Mustermann</Supporter>
        </SupporterList>
        <Datum>2013-06-21T11:15:38.068+02:00</Datum>
        <Beschreibung>gdfadsvabaervfasdf</Beschreibung>
        <Zustand>geschlossen</Zustand>
        <in_bearbeitung>false</in_bearbeitung>
        <Tags>
            <Tag>Hardware</Tag>
        </Tags>
    </Infos>
    <Antworten>
        <Antwort>
            <Supporter id="1">Max Mustermann</Supporter>
            <Datum>2013-06-23T18:20:04.152+02:00</Datum>
            <Antwort>fuck you</Antwort>
        </Antwort>
    </Antworten>
</Ticket>
