<?xml version="1.0" encoding="UTF-8" standalone="yes"?>
<Ticket xmlns="http://example.org/ticket" xmlns:xsi="http://www.w3.org/2001/XMLSchema-instance" id="8" xsi:schemaLocation="http://example.org/ticket ../../schema/TicketSchema.xsd">
    <Infos>
        <Betreff>fvdfsvcfdsv</Betreff>
        <User id="1">Max Mustermann</User>
        <Standort>Max</Standort>
        <SupporterList/>
        <Datum>2013-06-22T22:52:43.030+02:00</Datum>
        <Beschreibung>v  vdfvfdv</Beschreibung>
        <Zustand>normal</Zustand>
        <in_bearbeitung>false</in_bearbeitung>
        <Tags>
            <Tag>Software</Tag>
        </Tags>
    </Infos>
    <Antworten/>
</Ticket>
