<?xml version="1.0" encoding="UTF-8" standalone="yes"?>
<Ticket xmlns="http://example.org/ticket" xmlns:xsi="http://www.w3.org/2001/XMLSchema-instance" id="38" xsi:schemaLocation="http://example.org/ticket ../../schema/TicketSchema.xsd">
    <Infos>
        <Betreff>dritter Test</Betreff>
        <User id="7">Oliver Steinle</User>
        <Standort>CGN</Standort>
        <SupporterList/>
        <Datum>2013-06-10T14:36:12.121+02:00</Datum>
        <Beschreibung>Lorem ipsum dolor sit amet, consectetuer adipiscing elit. Aenean commodo ligula eget dolor. Aenean massa. Cum sociis natoque penatibus et magnis dis parturient montes, nascetur ridiculus mus. Donec quam felis, ultricies nec, pellentesque eu, pretium quis, sem. Nulla consequat massa quis enim. Donec pede justo, fringilla vel, aliquet nec, vulputate eget, arcu. In enim justo, rhoncus ut, imperdiet a, venenatis vitae, justo. Nullam dictum felis eu pede mollis pretium. Integer tincidunt. Cras dapibus. Vivamus elementum semper nisi. Aenean vulputate eleifend tellus. Aenean leo ligula, porttitor eu, consequat vitae, eleifend ac, enim. Aliquam lorem ante, dapibus in, viverra quis, feugiat a, tellus. Phasellus viverra nulla ut metus varius laoreet. Quisque rutrum. Aenean imperdiet. Etiam ultricies nisi vel augue. Curabitur ullamcorper ultricies nisi. </Beschreibung>
        <Zustand>Hoch</Zustand>
        <Tags>
            <Tag>Hardware</Tag>
            <Tag>Windows</Tag>
            <Tag>Android</Tag>
        </Tags>
    </Infos>
    <Antworten/>
</Ticket>
