<?xml version="1.0" encoding="UTF-8" standalone="yes"?>
<Ticket xmlns="http://example.org/ticket" xmlns:xsi="http://www.w3.org/2001/XMLSchema-instance" id="39" xsi:schemaLocation="http://example.org/ticket ../../schema/TicketSchema.xsd">
    <Infos>
        <Betreff>Hallo</Betreff>
        <User id="7">Oliver Steinle</User>
        <Standort>CGN</Standort>
        <SupporterList/>
        <Datum>2013-06-10T14:48:44.342+02:00</Datum>
        <Beschreibung>jlifjdlsafsd</Beschreibung>
        <Zustand>Niedrig</Zustand>
        <Tags>
            <Tag>Windows</Tag>
        </Tags>
    </Infos>
    <Antworten/>
</Ticket>
