<?xml version="1.0" encoding="UTF-8" standalone="yes"?>
<Ticket xmlns="http://example.org/ticket" xmlns:xsi="http://www.w3.org/2001/XMLSchema-instance" id="2" xsi:schemaLocation="http://example.org/ticket ../../schema/TicketSchema.xsd">
    <Infos>
        <Betreff>gfdgadfdsf</Betreff>
        <User id="1">Max Mustermann</User>
        <Standort>Max</Standort>
        <SupporterList>
            <Supporter id="1">Max Mustermann</Supporter>
        </SupporterList>
        <Datum>2013-06-21T11:15:30.166+02:00</Datum>
        <Beschreibung>dfsafdsgdfagfddsaf</Beschreibung>
        <Zustand>kritisch</Zustand>
        <in_bearbeitung>false</in_bearbeitung>
        <Tags>
            <Tag>Software</Tag>
        </Tags>
    </Infos>
    <Antworten/>
</Ticket>
