<?xml version="1.0" encoding="UTF-8" standalone="yes"?>
<Ticket xmlns="http://example.org/ticket" xmlns:xsi="http://www.w3.org/2001/XMLSchema-instance" id="4" xsi:schemaLocation="http://example.org/ticket ../../schema/TicketSchema.xsd">
    <Infos>
        <Betreff>fdsfdsfdsaf</Betreff>
        <User id="2">Oliver Steinle</User>
        <Standort>Cologne</Standort>
        <SupporterList>
        </SupporterList>
        <Datum>2013-06-22T09:23:58.826+02:00</Datum>
        <Beschreibung>gdfadsfdsfdsfasfsd</Beschreibung>
        <Zustand>niedrig</Zustand>
        <in_bearbeitung>false</in_bearbeitung>
        <Tags>
            <Tag>Software</Tag>
        </Tags>
    </Infos>
    <Antworten/>
</Ticket>
