<?xml version="1.0" encoding="UTF-8" standalone="yes"?>
<Ticket xmlns="http://example.org/ticket" xmlns:xsi="http://www.w3.org/2001/XMLSchema-instance" id="47" xsi:schemaLocation="http://example.org/ticket ../../schema/TicketSchema.xsd">
    <Infos>
        <Betreff>gdfagdg</Betreff>
        <User id="7">Oliver Steinle</User>
        <Standort>CGN</Standort>
        <SupporterList/>
        <Datum>2013-06-10T16:22:03.791+02:00</Datum>
        <Beschreibung>fasfagadfvdfg</Beschreibung>
        <Zustand>Niedrig</Zustand>
        <Tags>
            <Tag>Hardware</Tag>
            <Tag>Windows</Tag>
            <Tag>iOS</Tag>
        </Tags>
    </Infos>
    <Antworten/>
</Ticket>
