<?xml version="1.0" encoding="UTF-8" standalone="yes"?>
<Ticket xmlns="http://example.org/ticket" xmlns:xsi="http://www.w3.org/2001/XMLSchema-instance" id="29" xsi:schemaLocation="http://example.org/ticket ../../schema/TicketSchema.xsd">
    <Infos>
        <Betreff>Testbetreff</Betreff>
        <User id="1">Max Mustermann</User>
        <Standort>CGN</Standort>
        <SupporterList>
            <Supporter id="3">Michael Schmidt</Supporter>
        </SupporterList>
        <Datum>2013-06-07T20:59:35.455+02:00</Datum>
        <Beschreibung>Testbeschreibung</Beschreibung>
        <Zustand>normal</Zustand>
        <Tags>
            <Tag>Hardware</Tag>
        </Tags>
    </Infos>
    <Antworten/>
</Ticket>
