<?xml version="1.0" encoding="UTF-8" standalone="yes"?>
<Ticket xmlns="http://example.org/ticket" xmlns:xsi="http://www.w3.org/2001/XMLSchema-instance" id="49" xsi:schemaLocation="http://example.org/ticket ../../schema/TicketSchema.xsd">
    <Infos>
        <Betreff>fsdagfgfd</Betreff>
        <User id="7">Oliver Steinle</User>
        <Standort>CGN</Standort>
        <SupporterList/>
        <Datum>2013-06-10T16:34:58.220+02:00</Datum>
        <Beschreibung>gdfgdfvcvdfg</Beschreibung>
        <Zustand>Normal</Zustand>
        <Tags>
            <Tag>Windows</Tag>
            <Tag>Android</Tag>
        </Tags>
    </Infos>
    <Antworten/>
</Ticket>
